{
  "schema_version": "rri-v2-design-0.2",
  "mode": "candidate_only",
  "task": {
    "task_id": "example-unknown-temporal",
    "parent_id": null,
    "lineage_id": "example-unknown-temporal",
    "work_family": "maintenance",
    "kind": "maintenance",
    "baseline_sha": "example-baseline",
    "snapshot_at": "2026-09-07T00:00:00Z",
    "measurement_stage": "pre_implementation"
  },
  "applicability": {"status": "applicable", "reason": "Implementation behavior is within the rubric.", "evidence_refs": ["scenario"]},
  "axes": {
    "L": {"status": "estimated", "method": "inspection", "evidence_refs": ["scenario"], "level": 1},
    "I": {"status": "estimated", "method": "inspection", "evidence_refs": ["scenario"], "level": 1},
    "Q": {"status": "unknown", "method": "temporal semantics unresolved", "evidence_refs": ["scenario"], "range": [0, 4]},
    "V": {"status": "estimated", "method": "oracle design", "evidence_refs": ["scenario"], "level": 1}
  },
  "size": {"status": "unknown", "method": "not yet measured", "value": null, "evidence_refs": []},
  "uncertainty": {"unresolved": ["Temporal ordering semantics are not established."]},
  "risk": {"hazards": [], "likelihood": null}
}
